{
  "$schema": "../schemas/room.schema.json",
  "room_id": "hq_office",
  "display_name": "Alveus HQ Office",
  "grid": {
    "width": 11,
    "height": 11,
    "tile_size_px": 32
  },
  "walls": {
    "style": "perimeter",
    "color": { "r": 0.30, "g": 0.25, "b": 0.20 },
    "excluded_tiles": [
      { "x": 5, "y": 0 }
    ]
  },
  "floor": {
    "style": "fill_interior",
    "color": { "r": 0.20, "g": 0.18, "b": 0.15 }
  },
  "door": {
    "position": { "x": 5, "y": 0 },
    "wall_side": "south",
    "width_tiles": 1,
    "color": { "r": 0.40, "g": 0.30, "b": 0.18 }
  },
  "spawn_point": { "x": 5, "y": 2 },
  "exit_target": { "x": 25, "y": 9 },
  "objects": [
    {
      "object_id": "staff_roster_board",
      "display_name": "Staff Roster Board",
      "position": { "x": 2, "y": 8 },
      "is_obstacle": true,
      "is_interactable": true,
      "interaction": {
        "type": "open_menu",
        "menu_id": "staff_roster",
        "prompt_text": "View Staff Roster"
      },
      "color": { "r": 0.60, "g": 0.50, "b": 0.35 },
      "z_layer": 0.2
    },
    {
      "object_id": "stamp_album_desk",
      "display_name": "Stamp Album Desk",
      "position": { "x": 8, "y": 8 },
      "is_obstacle": true,
      "is_interactable": true,
      "interaction": {
        "type": "open_shop",
        "menu_id": "stamp_shop",
        "prompt_text": "Browse the Stamp Album"
      },
      "color": { "r": 0.50, "g": 0.38, "b": 0.25 },
      "z_layer": 0.2
    },
    {
      "object_id": "sanctuary_clipboard",
      "display_name": "Sanctuary Clipboard",
      "position": { "x": 5, "y": 7 },
      "size": { "w": 2, "h": 1 },
      "is_obstacle": true,
      "is_interactable": true,
      "interaction": {
        "type": "inspect",
        "menu_id": "sanctuary_status",
        "prompt_text": "Check sanctuary status report"
      },
      "color": { "r": 0.45, "g": 0.40, "b": 0.32 },
      "z_layer": 0.2
    },
    {
      "object_id": "donation_link_sign",
      "display_name": "Support Alveus Sign",
      "position": { "x": 5, "y": 9 },
      "is_obstacle": true,
      "is_interactable": true,
      "interaction": {
        "type": "external_link",
        "prompt_text": "Visit alveussanctuary.org/donate"
      },
      "color": { "r": 0.80, "g": 0.60, "b": 0.20 },
      "z_layer": 0.2
    },
    {
      "object_id": "hq_bookshelf",
      "display_name": "Bookshelf",
      "position": { "x": 1, "y": 5 },
      "size": { "w": 1, "h": 2 },
      "is_obstacle": true,
      "is_interactable": false,
      "color": { "r": 0.45, "g": 0.30, "b": 0.15 },
      "z_layer": 0.2
    },
    {
      "object_id": "hq_couch",
      "display_name": "Office Couch",
      "position": { "x": 8, "y": 3 },
      "size": { "w": 2, "h": 1 },
      "is_obstacle": true,
      "is_interactable": false,
      "color": { "r": 0.35, "g": 0.25, "b": 0.20 },
      "z_layer": 0.2
    }
  ],
  "animals": [],
  "zones": [],
  "dynamic_spawns": [],
  "ambient": {
    "floor_color": { "r": 0.20, "g": 0.18, "b": 0.15 },
    "wall_color": { "r": 0.30, "g": 0.25, "b": 0.20 },
    "background_color": { "r": 0.08, "g": 0.06, "b": 0.05 }
  }
}
