{
  "$schema": "../schemas/room.schema.json",
  "room_id": "nutrition_house",
  "display_name": "Nutrition House",
  "grid": {
    "width": 11,
    "height": 11,
    "tile_size_px": 32
  },
  "walls": {
    "style": "perimeter",
    "color": { "r": 0.25, "g": 0.28, "b": 0.30 },
    "excluded_tiles": [
      { "x": 5, "y": 0 }
    ]
  },
  "floor": {
    "style": "fill_interior",
    "color": { "r": 0.22, "g": 0.16, "b": 0.12 }
  },
  "door": {
    "position": { "x": 5, "y": 0 },
    "wall_side": "south",
    "width_tiles": 1,
    "color": { "r": 0.40, "g": 0.25, "b": 0.15 }
  },
  "spawn_point": { "x": 5, "y": 2 },
  "exit_target": { "x": 33, "y": 12 },
  "objects": [
    {
      "object_id": "diet_fridge",
      "display_name": "Diet Fridge",
      "position": { "x": 2, "y": 8 },
      "is_obstacle": true,
      "is_interactable": true,
      "interaction": {
        "type": "open_menu",
        "menu_id": "fridge_menu",
        "prompt_text": "Open Diet Fridge"
      },
      "color": { "r": 0.75, "g": 0.78, "b": 0.80 },
      "z_layer": 0.2
    },
    {
      "object_id": "prep_table",
      "display_name": "Prep Table",
      "position": { "x": 5, "y": 7 },
      "size": { "w": 3, "h": 1 },
      "is_obstacle": true,
      "is_interactable": true,
      "interaction": {
        "type": "mini_chore",
        "chore_id": "chop_veggies",
        "required_item_id": "raw_veggie_tub",
        "prompt_text": "Prepare diet at Prep Table"
      },
      "color": { "r": 0.10, "g": 0.50, "b": 0.40 },
      "z_layer": 0.2
    },
    {
      "object_id": "smoothie_blender",
      "display_name": "Smoothie Blender",
      "position": { "x": 7, "y": 8 },
      "is_obstacle": true,
      "is_interactable": true,
      "interaction": {
        "type": "mini_chore",
        "chore_id": "blend_smoothie",
        "prompt_text": "Blend a fruit smoothie"
      },
      "color": { "r": 0.85, "g": 0.85, "b": 0.90 },
      "z_layer": 0.2
    },
    {
      "object_id": "seed_chest",
      "display_name": "Seed Chest",
      "position": { "x": 2, "y": 5 },
      "is_obstacle": true,
      "is_interactable": true,
      "interaction": {
        "type": "give_item",
        "item_id": "chicken_grains",
        "prompt_text": "Scoop chicken grains from Seed Chest"
      },
      "color": { "r": 0.60, "g": 0.40, "b": 0.10 },
      "z_layer": 0.2
    },
    {
      "object_id": "polly_feed_bowl",
      "display_name": "Polly's Feed Bowl",
      "position": { "x": 8, "y": 3 },
      "is_obstacle": true,
      "is_interactable": true,
      "interaction": {
        "type": "feed_animal",
        "target_animal_id": "polly",
        "required_item_id": "chicken_grains",
        "stat_affected": "hunger",
        "stat_delta": 1.0,
        "prompt_text": "Fill Polly's feed bowl"
      },
      "color": { "r": 0.70, "g": 0.55, "b": 0.30 },
      "z_layer": 0.2
    },
    {
      "object_id": "polly_enrichment_post",
      "display_name": "Polly's Enrichment Zone",
      "position": { "x": 8, "y": 5 },
      "is_obstacle": true,
      "is_interactable": true,
      "interaction": {
        "type": "enrich_animal",
        "target_animal_id": "polly",
        "stat_affected": "happiness",
        "stat_delta": 1.0,
        "prompt_text": "Place mini-mirror for Polly"
      },
      "color": { "r": 0.90, "g": 0.80, "b": 0.20 },
      "z_layer": 0.2
    },
    {
      "object_id": "polly_nesting_box",
      "display_name": "Polly's Nesting Box",
      "position": { "x": 8, "y": 2 },
      "is_obstacle": true,
      "is_interactable": false,
      "color": { "r": 0.50, "g": 0.35, "b": 0.15 },
      "z_layer": 0.2
    }
  ],
  "animals": [
    {
      "animal_id": "polly",
      "home_position": { "x": 8, "y": 4 },
      "wander_zone": {
        "bottom_left": { "x": 7, "y": 1 },
        "top_right": { "x": 9, "y": 5 }
      }
    }
  ],
  "zones": [
    {
      "zone_id": "polly_playpen",
      "display_name": "Polly's Playpen",
      "bounds": {
        "bottom_left": { "x": 7, "y": 1 },
        "top_right": { "x": 9, "y": 5 }
      },
      "fence_sides": ["north", "west"],
      "gate_position": { "x": 7, "y": 3 }
    }
  ],
  "dynamic_spawns": [],
  "ambient": {
    "floor_color": { "r": 0.22, "g": 0.16, "b": 0.12 },
    "wall_color": { "r": 0.25, "g": 0.28, "b": 0.30 },
    "background_color": { "r": 0.05, "g": 0.05, "b": 0.08 }
  }
}
