{
  "$schema": "../schemas/room.schema.json",
  "room_id": "push_pop_enclosure",
  "display_name": "Push Pop Enclosure",
  "grid": {
    "width": 13,
    "height": 13,
    "tile_size_px": 32
  },
  "walls": {
    "style": "perimeter",
    "color": { "r": 0.45, "g": 0.38, "b": 0.28 },
    "excluded_tiles": [
      { "x": 6, "y": 0 }
    ]
  },
  "floor": {
    "style": "fill_interior",
    "color": { "r": 0.72, "g": 0.62, "b": 0.45 }
  },
  "door": {
    "position": { "x": 6, "y": 0 },
    "wall_side": "south",
    "width_tiles": 1,
    "color": { "r": 0.50, "g": 0.40, "b": 0.28 }
  },
  "spawn_point": { "x": 6, "y": 2 },
  "exit_target": { "x": 39, "y": 16 },
  "objects": [
    {
      "object_id": "push_pop_feeding_dish",
      "display_name": "Push Pop's Feeding Dish",
      "position": { "x": 8, "y": 6 },
      "is_obstacle": true,
      "is_interactable": true,
      "interaction": {
        "type": "feed_animal",
        "target_animal_id": "push_pop",
        "required_item_id": "tortoise_leafy_greens",
        "stat_affected": "hunger",
        "stat_delta": 1.0,
        "prompt_text": "Place leafy greens for Push Pop"
      },
      "color": { "r": 0.55, "g": 0.45, "b": 0.30 },
      "z_layer": 0.2
    },
    {
      "object_id": "push_pop_shelter",
      "display_name": "Push Pop's Shelter",
      "position": { "x": 3, "y": 9 },
      "size": { "w": 2, "h": 2 },
      "is_obstacle": true,
      "is_interactable": false,
      "color": { "r": 0.40, "g": 0.32, "b": 0.22 },
      "z_layer": 0.2
    }
  ],
  "animals": [
    {
      "animal_id": "push_pop",
      "home_position": { "x": 8, "y": 4 },
      "wander_zone": {
        "bottom_left": { "x": 5, "y": 3 },
        "top_right": { "x": 10, "y": 8 }
      }
    }
  ],
  "zones": [
    {
      "zone_id": "push_pop_wander_area",
      "display_name": "Push Pop's Wander Area",
      "bounds": {
        "bottom_left": { "x": 5, "y": 3 },
        "top_right": { "x": 10, "y": 8 }
      },
      "fence_sides": [],
      "gate_position": { "x": 6, "y": 0 }
    }
  ],
  "dynamic_spawns": [],
  "ambient": {
    "floor_color": { "r": 0.72, "g": 0.62, "b": 0.45 },
    "wall_color": { "r": 0.45, "g": 0.38, "b": 0.28 },
    "background_color": { "r": 0.55, "g": 0.50, "b": 0.40 }
  }
}
